{
  "duration_ms": 339,
  "packet_id": "M0-PACKET-001",
  "python": "3.13.5",
  "result": "PASS",
  "schema_version": "1.0",
  "tests": [
    {
      "case_id": "M0-DUMMY-GRACEFUL",
      "exit_code": 0,
      "orphan_zero": true,
      "result": "PASS"
    },
    {
      "case_id": "M0-DUMMY-TERMINATE",
      "exit_code": -15,
      "orphan_zero": true,
      "result": "PASS"
    },
    {
      "case_id": "M0-DUMMY-FORCE-KILL",
      "escalation_observed": true,
      "exit_code": -9,
      "orphan_zero": true,
      "result": "PASS"
    }
  ]
}
